<?xml version="1.0" encoding="UTF-8"?>
<bisdw xmlns:xsi="http://www.w3.org/2001/XMLSchema-instance"
	xsi:noNamespaceSchemaLocation="../src/main/resources/bisdw.xsd">
	<etljob>
		<name>read_DB</name>
		<desc>Database</desc>
		<schedule>0 */1 * * * ?</schedule>

		<etlconfig name="read_db">
			<desc>read db</desc>
			<class>com.ingby.socbox.bisdw.etlprovider.ETLScriptella</class>
			<order>10</order>
			<property>
				<key>configFile</key>
				<value>read_db.xml</value>
			</property>
		</etlconfig>

	</etljob>




</bisdw>

